card_number,price,title,rarity,store,set_name,condition,stock,available_variants,url
OP01-017,3140.0,Nico Robin (English Version 1st Anniversary Set) [One Piece Promotion Cards],Rare,Big Bang Shop,One Piece Promotion Cards,Near Mint Foil,In stock,Near Mint Foil R3140.00,https://bigbangshop.co.za/collections/one-piece-single-cards/products/nico-robin-english-version-1st-anniversary-set-one-piece-promotion-cards
OP01-035,1090.0,Okiku (SP) [500 Years in the Future],Rare,Big Bang Shop,500 Years in the Future,Near Mint Foil,In stock,Near Mint Foil R1090.00,https://bigbangshop.co.za/collections/one-piece-single-cards/products/okiku-sp-500-years-in-the-future
OP02-001,659.0,Edward.Newgate (Special Goods Set -Former Four Emperors-) [One Piece Promotion Cards],Leader,Knightly Gaming,One Piece Promotion Cards,Near Mint Foil,In stock,Near Mint Foil R659.00,https://www.knightlygaming.co.za/collections/one-piece-singles/products/edward-newgate-special-goods-set-former-four-emperors-one-piece-promotion-cards
OP03-114,1130.0,Charlotte Linlin (SP) [Wings of the Captain],Super Rare,Big Bang Shop,Wings of the Captain,Near Mint Foil,In stock,Near Mint Foil R1130.00,https://bigbangshop.co.za/collections/one-piece-single-cards/products/charlotte-linlin-sp-wings-of-the-captain
OP05-074,322.0,"Eustass""Captain""Kid (OP05-074) (Alternate Art) [Premium Booster -The Best-]",Super Rare,Knightly Gaming,Premium Booster -The Best-,Near Mint Foil,In stock,Near Mint Foil R322.00,https://www.knightlygaming.co.za/collections/one-piece-singles/products/eustasscaptainkid-op05-074-alternate-art-premium-booster-the-best
OP06-101,30.0,O-Nami | OP06-101 | OP-06 Wings of the Captain,,Marvellous Hobbies,,,2 in stock,2 in stock,https://marvelloushobbies.com/product/o-nami-op06-101-op-06-wings-of-the-captain/
OP06-115,525.0,You're the One Who Should Disappear (Alternate Art) [Premium Booster -The Best- Vol. 2],Rare,Knightly Gaming,Premium Booster -The Best- Vol. 2,Near Mint Foil,In stock,Near Mint Foil R525.00,https://www.knightlygaming.co.za/collections/one-piece-singles/products/youre-the-one-who-should-disappear-alternate-art-premium-booster-the-best-vol-2
OP06-115,585.0,You're the One Who Should Disappear (Alternate Art) [Premium Booster -The Best- Vol. 2],Rare,Big Bang Shop,Premium Booster -The Best- Vol. 2,Near Mint Foil,In stock,Near Mint Foil R585.00,https://bigbangshop.co.za/collections/one-piece-single-cards/products/youre-the-one-who-should-disappear-alternate-art-premium-booster-the-best-vol-2
OP07-072,55.0,Porche [500 Years in the Future],Super Rare,Big Bang Shop,500 Years in the Future,Near Mint Foil,In stock,Near Mint Foil R55.00,https://bigbangshop.co.za/collections/one-piece-single-cards/products/porche-500-years-in-the-future
OP07-085,290.0,Stussy (Parallel) [500 Years in the Future],Super Rare,Big Bang Shop,500 Years in the Future,Near Mint Foil,In stock,Near Mint Foil R290.00,https://bigbangshop.co.za/collections/one-piece-single-cards/products/stussy-parallel-500-years-in-the-future
OP08-087,1.0,Scratchmen Apoo (OP08-087) (Reprint) [Premium Booster -The Best- Vol. 2],Uncommon,Knightly Gaming,Premium Booster -The Best- Vol. 2,Near Mint,In stock,Near Mint R1.00,https://www.knightlygaming.co.za/collections/one-piece-singles/products/scratchmen-apoo-op08-087-reprint-premium-booster-the-best-vol-2
OP08-087,1.0,Scratchmen Apoo [Two Legends],Uncommon,Knightly Gaming,Two Legends,Near Mint,In stock,Near Mint R1.00,https://www.knightlygaming.co.za/collections/one-piece-singles/products/scratchmen-apoo-two-legends
OP08-087,3.0,Scratchmen Apoo (OP08-087) (Pirate Foil) [Premium Booster -The Best- Vol. 2],Uncommon,Knightly Gaming,Premium Booster -The Best- Vol. 2,Near Mint Foil,In stock,Near Mint Foil R3.00,https://www.knightlygaming.co.za/collections/one-piece-singles/products/scratchmen-apoo-op08-087-pirate-foil-premium-booster-the-best-vol-2
OP08-087,5.0,Scratchmen Apoo – OP08-087 – Two Legends (OP08),,Marvellous Hobbies,,,6 in stock,6 in stock,https://marvelloushobbies.com/product/scratchmen-apoo-two-legends-op08/
OP08-087,5.0,Scratchmen Apoo,Uncommon,Tanuki Trader,Two Legends (OP08),,33 in stock,33 in stock,https://tanukitrader.co.za/product/scratchmen-apoo-4/
OP10-071,86.0,Donquixote Doflamingo [Royal Blood],Super Rare,Knightly Gaming,Royal Blood,Near Mint Foil,In stock,Near Mint Foil R86.00,https://www.knightlygaming.co.za/collections/one-piece-singles/products/donquixote-doflamingo-royal-blood
OP11-038,3.0,Gum-Gum Elephant Gatling [A Fist of Divine Speed],Rare,Knightly Gaming,A Fist of Divine Speed,Near Mint Foil,In stock,Near Mint Foil R3.00,https://www.knightlygaming.co.za/collections/one-piece-singles/products/gum-gum-elephant-gatling-a-fist-of-divine-speed
OP11-054,727.0,Nami (054) (Alternate Art) [A Fist of Divine Speed],Super Rare,Knightly Gaming,A Fist of Divine Speed,Near Mint Foil,In stock,Near Mint Foil R727.00,https://www.knightlygaming.co.za/collections/one-piece-singles/products/nami-054-alternate-art-a-fist-of-divine-speed
OP11-114,3.0,Gum-Gum Fire-Fist Pistol Red Hawk [A Fist of Divine Speed],Rare,Knightly Gaming,A Fist of Divine Speed,Near Mint Foil,In stock,Near Mint Foil R3.00,https://www.knightlygaming.co.za/collections/one-piece-singles/products/gum-gum-fire-fist-pistol-red-hawk-a-fist-of-divine-speed
OP12-118,345.0,Jewelry Bonney [Legacy of the Master],Secret Rare,Big Bang Shop,Legacy of the Master,Near Mint Foil,In stock,Near Mint Foil R345.00,https://bigbangshop.co.za/collections/one-piece-single-cards/products/jewelry-bonney-legacy-of-the-master
OP12-119,405.0,Bartholomew Kuma [Legacy of the Master],Secret Rare,Big Bang Shop,Legacy of the Master,Near Mint Foil,In stock,Near Mint Foil R405.00,https://bigbangshop.co.za/collections/one-piece-single-cards/products/bartholomew-kuma-legacy-of-the-master
OP12-119,619.0,Bartholomew Kuma (Alternate Art) [Legacy of the Master],Secret Rare,Knightly Gaming,Legacy of the Master,Near Mint Foil,In stock,Near Mint Foil R619.00,https://www.knightlygaming.co.za/collections/one-piece-singles/products/bartholomew-kuma-alternate-art-legacy-of-the-master
OP13-086,8.0,Saint Shalria,Uncommon,Tanuki Trader,Carrying On His Will (OP13),,6 in stock,6 in stock,https://tanukitrader.co.za/product/saint-shalria/
OP13-091,10.0,St. Marcus Mars,Rare,Tanuki Trader,Carrying On His Will (OP13),,3 in stock,3 in stock,https://tanukitrader.co.za/product/st-marcus-mars/
OP13-108,641.0,Jewelry Bonney (Alternate Art) [Carrying On His Will],Super Rare,Knightly Gaming,Carrying On His Will,Near Mint Foil,In stock,Near Mint Foil R641.00,https://www.knightlygaming.co.za/collections/one-piece-singles/products/jewelry-bonney-alternate-art-carrying-on-his-will
OP14-031,1352.0,Nami (Alternate Art) [The Azure Sea's Seven],Super Rare,Knightly Gaming,The Azure Sea's Seven,Near Mint Foil,In stock,Near Mint Foil R1352.00,https://www.knightlygaming.co.za/collections/one-piece-singles/products/nami-alternate-art-the-azure-seas-seven
OP14-033,557.0,Perona (Alternate Art) [The Azure Sea's Seven],Super Rare,Knightly Gaming,The Azure Sea's Seven,Near Mint Foil,In stock,Near Mint Foil R557.00,https://www.knightlygaming.co.za/collections/one-piece-singles/products/perona-alternate-art-the-azure-seas-seven
OP14-084,932.0,Ms. All Sunday (Alternate Art) [The Azure Sea's Seven],Super Rare,Knightly Gaming,The Azure Sea's Seven,Near Mint Foil,In stock,Near Mint Foil R932.00,https://www.knightlygaming.co.za/collections/one-piece-singles/products/ms-all-sunday-alternate-art-the-azure-seas-seven
OP14-091,379.0,Mr.2.Bon.Kurei (Bentham) (Alternate Art) [The Azure Sea's Seven],Super Rare,Knightly Gaming,The Azure Sea's Seven,Near Mint Foil,In stock,Near Mint Foil R379.00,https://www.knightlygaming.co.za/collections/one-piece-singles/products/mr-2-bon-kurei-bentham-alternate-art-the-azure-seas-seven
OP14-096,2107.0,Ground Death (Alternate Art) [The Azure Sea's Seven],Rare,Knightly Gaming,The Azure Sea's Seven,Near Mint Foil,In stock,Near Mint Foil R2107.00,https://www.knightlygaming.co.za/collections/one-piece-singles/products/ground-death-alternate-art-the-azure-seas-seven
ST01-006,420.0,Tony Tony.Chopper [One Piece Film: Red],Common,Big Bang Shop,One Piece Film: Red,Near Mint Foil,In stock,Near Mint Foil R420.00,https://bigbangshop.co.za/collections/one-piece-single-cards/products/tony-tony-chopper-one-piece-film-red
ST01-007,3485.0,Nami (TR),,Tanuki Trader,Wings of the Captain (OP06),,1 in stock,1 in stock,https://tanukitrader.co.za/product/nami-tr/
ST01-011,3.0,Brook (ST01-011) (Reprint) [Premium Booster -The Best- Vol. 2],Common,Knightly Gaming,Premium Booster -The Best- Vol. 2,Near Mint,In stock,Near Mint R3.00,https://www.knightlygaming.co.za/collections/one-piece-singles/products/brook-st01-011-reprint-premium-booster-the-best-vol-2
ST01-014,3.0,Guard Point [Starter Deck: Straw Hat Crew],Common,Knightly Gaming,Starter Deck: Straw Hat Crew,Near Mint,In stock,Near Mint R3.00,https://www.knightlygaming.co.za/collections/one-piece-singles/products/guard-point-starter-deck-straw-hat-crew
